{
  "schema_version": "1.0.0",
  "package_version": 1,
  "package_id": "fixture-publish-v1",
  "approval_status": "approved-publish",
  "generated_at": "2026-07-16T00:00:00.000Z",
  "entries": [
    {
      "id": "fixture-human-judgment",
      "slug": "human-judgment-before-shipping",
      "revision": 2,
      "kind": "case-study",
      "language": "zh-CN",
      "cognition_status": "understood",
      "title": "上线之前，先判断产品是否真的可用",
      "core_question": "通过测试的页面是否已经具备上线价值？",
      "human_gain": [
        "能够识别页面壳与完整产品之间的差距"
      ],
      "mental_model": "发布条件不仅包括页面存在，还包括权限、数据和恢复边界。",
      "delegable_capabilities": [
        "构建、静态检查和重复性验证"
      ],
      "retained_capabilities": [
        "决定上线条件是否成立并承担发布责任"
      ],
      "transfer_scenarios": [
        "任何依赖权限或生产数据的功能上线"
      ],
      "evidence": [
        {
          "label": "公开的产品说明"
        }
      ],
      "open_questions": [
        "怎样让上线门禁更早暴露缺口？"
      ],
      "body_markdown": "## 判断\n\n页面存在，不等于产品可用。",
      "related_blog_groups": [],
      "entry_hash": "fab09935cd6eb649eb549a07c87398a4f85e60e93654576fe2fb2dfa203aaa5f"
    }
  ],
  "content_hash": "8de593f7ae6c13d4fbd4cf9deb77721e4b51c6074d9d1f574d737136267543cb"
}
